clean_text,subreddit
state michigan roughli 76 percent white 14 percent black state michigan incred document entitl michigan incid crime report micr basic say black comiti disproportion number murder happen white person 911 black individu state michigan determin racial motiv consid hate crime accord propos democrat governor michigan ignor bigger issu black disproportion fals accus trust crime stat crime stat realli reliabl concern race consid corrupt goe,AskSocialScience
creat fake data repres problem work short patient arriv hospit health measur taken record immedi discharg hospit requir stay given new patient enter hospit health measur taken need predict response_vari patient immedi discharg hospit stay data 50 year obviou societi peopl s health medicin chang 50 year e g life expect increas world 1971 elderli man smoke entir life stay prolong period hospit 2019 given new drug develop 5 year immedi discharg big macro micro time depend trend variabl need taken account creat statist model far creat decis tree c5 algorithm complet ignor time variabl assum elderli man 1971 smoke ident elderli man smoke 2019 complet ignor time variabl abl creat standard decis tree model produc good result test differ 1st train decis tree random 70 sampl data record perform remain 30 data 2nd kept data 2019 separ train decis tree data previou year record perform decis tree 2019 s data test perform decis tree good requir make curiou look imgur pictur kind data statist consid panel data cross section data longitudin data time data feel longitudin data far understand longitudin data repeatedli record measur patient e g year far concern patient data uniqu deal multivari time data help identifi kind data model usual classifi kind data model result good curiou thank kind data panel data longitudin data cross section data time data,AskSocialScience
happi monday kinda weird m look simpli troubl typic avenu m hope m referenc superior search engin skill s read studi base ncv similar survey n size fairli larg assum nation survey scale unit state regard outcom burglari key area focu type respons victim home includ yell person wield weapon kind non firearm bat golf club wield brandish firearm delin type yell weapon firearm action perpetr crime victim took big tabl note base data rememb yell burglar better outcom term victim s person safeti brandish firearm hope help d realli love dive studi deeper gotten lot better vers amateur research small thank sub compar year ago initi studi thank hope great day 3 tomt type defens gun burglari arm break scenario outcom studi,AskSocialScience
watch elect outsid awar gener proceed elector colleg jazz follow close year assum result news network elect night base press releas elect commiss individu state network s decis desk announc statist winner perspect smaller countri news network releas result exit poll time poll close updat state elector commiss releas vote talli night network specul outcom elect commiss releas offici result preliminari final m awar decis desk announc project winner s high degre certainti famou come result accept basic offici public foreign govern did practic news network result presidenti elect origin,AskSocialScience
guess approach straight ask peopl categor forc preexist categori ask gender assign govern institut countri legal recogn non binari gender articl googl scholar subject exampl m sure kind consensu social scienc research deal kind guess depend lot kind place purpos survey d learn differ approach set survey includ gender suggest read subject good exampl survey includ kind account non binari gender context job set survey ask peopl gender main focu survey d avoid methodolog pitfal avoid exclud peopl recogn man woman categori m curiou subject gener d hear variou social scienc perspect thank lot deal gender survey particular non binari gender,AskSocialScience
m learn read habit world m sure ask countri read book novel countri read gender differ read habit women read,AskSocialScience
m speak urban suburban rural differ polit main drive factor polit mindset drive peopl choos live live drive polit mindset work live influenc polit polit influenc live,AskSocialScience
doubt variabl cover privat health insur plan curiou univers health coverag countri propos sander gener permiss care cover analysi care length hospit stay type care surgeri week session rehabilit ect univers healthcar plan gener permiss coverag privat health insur,AskSocialScience
graph support claim mayb m wrong enter product gap order replac wage stagnat econom social reward great class tension escal tension affect gap inject societi ensur stabil 70 product worker gone dramat averag hourli compens stay product gap ensur stabil,AskSocialScience
attempt tool complex theori forecast elect versu tradit statist method poll,AskSocialScience
key talk point 2016 2020 presidenti elect regardless result appear divid polaris nation social scienc articl recommend sort unresolv tension lead possibl solut creat middl ground public normal post short read thread doesn t appear sticki thank past presidenti elect indic public polaris social scienc say unresolv polaris resolv,AskSocialScience
gunman respons attack vienna left peopl dead monday night convict support islam state group govern say gunman respons attack vienna left peopl dead monday night convict support islam state group govern say fool offici radicalis effort sourc radic program work effect overal measur prevent particip fool terrorist reform program work,AskSocialScience
late notic peopl especi youth world countri satisfi live countri dream better place dream home outsid countri youth work deal issu youth world countri,AskSocialScience
presid 2 term limit run presid 2 term run lose reelect t run vice presid presid incap run countri vp offic violat 2 term limit list presidenti success doesn t stop vp die speaker hous die cabinet member mean exampl obama serv cabinet speaker hous posit presid unabl,AskSocialScience
hey read articl discuss authoritarian thrive world realiz littl condit allow thrive specif countri feel come feel isol larg elector wrong t drive s turn fine educ scholar think set groundwork authoritarian leader think groundwork stay compar countri authoritarian leader presid sorri huge open end feel free pick choos piec d societ attribut allow authoritarian thrive,AskSocialScience
notabl research book social scienc past 5 year,AskSocialScience
effect increas govern spend deficit reduct expect output long run econom m kinda confus think ambigu long run confus,AskSocialScience
success portug model heroin addict clear treat addict medic issu provid heroin methadon addict clear portug model deal recreat heroin hard drug let s consid marijuana non issu 2017 articl portug s drug polici portug s radic drug polici work hasn t world copi offer unusu perspect portug s polici rest pillar s thing soft hard drug healthi unhealthi relationship drug individu s unhealthi relationship drug conceal fray relationship world told think drug addict simpli term health diseas reduct peopl abl drug year major disrupt person profession relationship problem told problem point local activist press joão goulão portug s drug czar legal cannabi sale portug year respond time wasn t right legalis singl substanc foundat portug s drug harm reduct philosophi drug aren t problem problem relationship drug s thing hard soft drug illicit substanc treat equal argu shouldn t drug legalis regul perspect translat drug polici messag drug educ ideal e effect control harm drug impart prospect drug addict 2016 articl portug drug offer procedur portugues author t arrest peopl 10 day suppli illicit drug instead drug offend order appear dissuas panel legal social psycholog expert case simpli suspend presum marijuana repeatedli caught identifi addict panel order sanction treatment recreat face fine order provid commun servic overview leav uncertainti messag drug point sentenc entir true term recreat drug drug educ ought inform peopl doesn t start drug ponder think group problem mayb 20 25 hard drug rank write portug model discuss heroin marijuana written meth cocain crack ecstasi design drug pcp drug fairli common america second link write heroin highlight efficaci portug s model today come panel fact caught hashish cannabi portug s drug polici reflect experi drug addict caus social scienc clarifi portug s think illeg drug explain nation s approach regard coher portug model applic america portug model cope illeg drug highli regard model deal recreat drug,AskSocialScience
link academ studi certainli insight voter pattern western democraci white collar profession far vote centr right parti blue collar worker gener vote centr left parti seen uk australia nz elect result typic upper middl class profession financ legal support centr left parti low paid blue collar worker labour support worker driver vote conserv fascin trend white collar profession vote democrat blue collar worker vote republican,AskSocialScience
law larg number level polit prefer state consist 10 000 peopl mathemat principl peopl differ polit prefer evenli distribut 50 state state produc rough similar elect result continu intermix peopl migrat happen fast compar state s intern social effect consid basic mechan singl usa state dominantli inclin polit parti,AskSocialScience
make good impress stem relat team properli team best impress,AskSocialScience
liber conserv align quit common western democraci m familiar countri promin parti tend ascrib posit liber conserv continuum clearli differ time protest vs cathol domin europ past function democraci tend converg view viewpoint liber conserv axi right human make want sort categori major perspect democrat polit gener tend align liber conserv divis major lens polit opinion view separ,AskSocialScience
organis uk s public research fund agenc uk univers s open public globe attend link websit event highlight list click univers list event week s bunch free onlin event talk run social scientist uk,AskSocialScience
articl suggest trumpism polit product inequilti instil neoliber,AskSocialScience
field think suit middl class resid western world make greatest impact world individu group form join sole effort individu lifetim polit social scienc compar individu make meaning chang world lifetim,AskSocialScience
main motiv post simpl vagu percentag american racist did tri look poll studi came surprisingli short lot poll poll american view statu racial equal countri assess consid racial view word somebodi believ race aren t social construct posit neg opinion certain race ethnic poll think peopl probabl seen suggest 9 american sympath neo nazi coupl year ago t result differ say 20 year prior poll specif ask white supremacist view definit concern racist ideolog america opinion necessarili repres racist view includ black supremaci antisemit islamophobia recogn racism bit spectrum size spectrum debat line outright racist view racial insensit ignor view blurri word m expect definit percentag american racist feel s feasibl grasp exampl percentag american believ black peopl inferior superior white peopl potenti degre think inferior superior ask percentag american racist worth ask poll research specif racial ethnic view american literatur say american racial view vari demograph view chang time compar countri challeng research topic address futur look scientif literatur racial ethnic view america,AskSocialScience
michael parenti s invent realiti relev media today better updat view today s media line invent realiti,AskSocialScience
russia develop countri orthodox church power restrict access birth control popul live poverti lot peopl emigr russia similar countri nigeria pakistan factor oil driven economi corrupt resembl nigeria recent watch bbc documentari russia s war women scene stacey dooley interview fairli typic russian man discuss man beat wife upload scene youtub titl upload littl insincer impress got man documentari russia conserv patriarch religi countri countri sub saharan africa middl east look russia s demograph russia actual low birth rate fact s tfr closer germani nigeria actual lower unit kingdom far secular urban advanc countri isn t tradit countri cradl popul growth t nigeria pakistan low birth rate despit similar mention t russian high birth rate,AskSocialScience
receiv invit popular person assess took mention brand person assess format trait descript pick identifi e strongli agre descript partial agre descript neutral partial agre descript b strongli agre descript b 200 time congrat gryffindor s person type insight skeptic say come valid test said t want bia make lose babi bathwat research say type solut method brand gener bunk provid valuabl insight valid variou person type assess method tool product,AskSocialScience
recent stumbl documentari flat earther curv haven t seen tri websit watch free hehe trailer youtub multipl comment documentari flat earther prove experi earth round m look book work specif sourc promot type behaviour peopl easili suck conspiraci theori peopl make accept conspiraci theori pretens taught blind aspect think flat earther,AskSocialScience
harm fals accus individu social,AskSocialScience
peopl low iq 80 career wise unintellig person capabl manag live social welfar unintellig relat poverti poverti lead person intellig unintellig person born normal famili end poor unless taken care famili initi statement mention idea low iq understand peopl certain disabl score lower iq test intellig talk case iq test unreli heard unintellig lose place societi lectur j peterson unintellig peopl troubl job face difficulti search job especi demand physic labor replac machin lead poverti poverti lead uneduc drug pregnanc crimin behaviour born poverti caus cycl begin accord websit 10 peopl iq lower 80 15 sd assum number complet reliabl mean 800 million peopl pretti unintellig isn t problem worri western countri spain 500 thousand peopl 50 million averag iq 98 oppos 100 reason ask student parent graduat accord sourc safe assum iq 105 mind assum social circl uni famili friend grew intellig peopl didn t friend school didn t peopl set idea unintellig world iq 80 realli stupid pretti normal peopl wouldn t abl differenti random set wrong assumpt post open correct assumpt idea evolv open read studi topic t studi psycholog sociolog troubl relev articl topic awar iq test reliabl mention iq mean type intellig number studi game bias differ kind intellig math vs pattern vs languag vs place capabl peopl low iq societi,AskSocialScience
kpop fan actual fanat pop fan sociolog reason,AskSocialScience
hello read paper carlsmith k m wilson t d gilbert d t 2008 paradox consequ reveng journal person social psycholog 95 6 1316 1324 conclud reveng harm suspect participand sampl occident consequ educ christian cultur think possibl peopl educ non christian cultur increas reveng long term harm consequ sure peopl non christian countri feel occident reveng send research subjetc ll total grate best regard reveng,AskSocialScience
m tri compil list studi talk racism m realli sure look start wonder s debat racism exist biggest critiqu social scientist racism s studi debat sociologist racism,AskSocialScience
thought consid ban turkish ultra nationalist grey wolf franc social scienc say immigr vote left wing parti countri live vote right wing parti home countri observ correct studi ye,AskSocialScience
s gener viewpoint poverti mother crime speak decid light investig claim myriad differ suggest regard theori strong predictor violent crime meaning predict crime explain discrep differ group s far understand social scienc tri attempt understand differ studi curiou gener consensu social scientist effect poverti crime rate explain racial crime gap usa poverti lead violent crime explain racial crime gap,AskSocialScience
work advertis deal cognit bias behavior econom nudg design lot profession read noam chomski s manufactur consent lot rang true felt helicopt view look power influenc actual mechan oper importantli work wonder connect creat framework analysi specif method techniqu media build enforc narr public cognit bias lead effect richard thaler did write brexit specif seen analysi populist politician leverag cognit bias d particularli macro perspect chomski did necessarili explor constraint specif issu academia appli behavior econom framework chomski s write manufactur consent specif cognit bias media tri leverag public,AskSocialScience
year ago stat professor share anecdot situat elect poll result heavili skew peopl associ pollster s shirt polit faction googl fu fail happen pass exampl weird thing make poll hard rememb countri s democrat elect long time differ color pollser predict team blue win handili team red win pollster theoriz blue shirt board peopl nervou admit support team red recent past caught support wrong risk violenc punish opposit time pollster send peopl red blue white shirt red shirt predict skew red blue shirt predict skew blue white shirt predict best answer did professor anecdot shirt equip color skew poll result realli happen,AskSocialScience
american elect believ want bend rule steal elect trust suprem court justic appoint make unbias rule trust prosecutor fairli select polit relev case trust cdc doctor best heart social scientist think root caus lack trust deeper partisanship countri fall hole warn sign path citizen fight nation declin trust,AskSocialScience
paper exampl weird western educ industri rich develop label sociolog bound,AskSocialScience
view distribut mean view quintil percentil produc content view distribut content creator answer non peer review sourc pm look bit averag view distribut content differ social media platform,AskSocialScience
alfi kohn psychologist teacher specialis area incent disciplin common educ method common claim includ extern incent improv perform regard complex task competit make peopl product better deal failur homework help student convent educ riddl flaw hurt student critiqu claim commonli alfi kohn,AskSocialScience
m think parliamentari westminst tradit member parliament determin prime minist set asid issu gerrymand rapid account fact pm remov lose confid vote isn t determin head govern similar elector colleg peopl choos elector determin presid higher granular westminst parliament make differ isn t elector colleg similar parliamentari mp elect prime minist,AskSocialScience
exampl hear prime minist israel netanyahu presid franc s revers hear presid macron prime minist person role presid prime minist variou countri realli uniqu countri countri presid prime minist come hear presid prime minist,AskSocialScience
strictli posit approach did 2016 elect predict wrong statist mistak 2016 elect,AskSocialScience
want s attitud evid rise singl parent household evid option abort pregnanc make men support women pregnant,AskSocialScience
egoism popular cultur regard bad thing need overcom,AskSocialScience
read alexand wendt s foundat constructivist piec intern relat anarchi state make wendt mention kenneth waltz s imag man state war suggest fourth constructiv man state war waltz draw long dead philosoph explain logic imag add fourth cite professor tell constructiv sprung social scienc recommend peter berger s 1966 sociolog book social construct realiti idea constructiv common sens s difficult believ intellectu foundat came 20th centuri constructiv older intellectu origin philosoph sociolog origin constructiv,AskSocialScience
high qualiti evid relat variabl hypothesi trait distribut male femal similar mean distribut male greater rang bodi research lead clear conclus,AskSocialScience
eugen necessarili mandatori thing eugen voluntari non enforc abil chang s attribut lead lack divers peopl thing discrimin peopl easili abl chang trait social consid desir major differ eugen transhuman,AskSocialScience
good research concern neg posit matter extern s action vari cultur,AskSocialScience
peopl minor discrimin peopl minor,AskSocialScience
underli news content presumpt societi bad flaw actor exposur media s role dynamist right light ought shown enabl innov trend emerg critic profit drive content away posit pro action coverag work stacist media assumpt valid,AskSocialScience
teach colleg undergradu cours research method emphasi inform literaci spent good time discuss scientif assess assess gener provid non expert excel overview state scientif field authorit usual access tri wade peer review literatur directli background environment studi primari exampl ipcc millennium ecosystem assess coupl differ student ask scientif assess social scienc said m familiar abl report nation academi m curiou major landmark assess social scienc good exampl student larg scope signific scientif assess social scienc good exampl thank edit didn t realiz scientif assess wide term scienc think synonym review summari consensu report essenti group expert review exist scientif literatur particular topic produc synthesi report policymak public landmark scientif assess social scienc,AskSocialScience
m curiou extent small group regularli lot children affect overal curv orthodox jew amish usual count studi total fertil hyper fertil religi minor amish orthodox jew quiverful fundamentalist observ effect total american fertil,AskSocialScience
seen strategi onlin demonstr actual effect evid base strategi student adhd learn disabl employ help achiev goal,AskSocialScience
recent complet master s degre school educ elect elect cours statist open new world social scienc wasn t previous awar casual read thing measur theori educ variou quantit method polit scientist quantit psycholog area said social scienc field known robust statist quantit methodolog lack thereof social scienc field robust quantit methodolog,AskSocialScience
read depth inform vaush talk 2 47 46 debt,AskSocialScience
m look mentor tutor help qualit research,AskSocialScience
develop grade qualiti polic depart base criteria number complaint transpar account basic composit assort metric paint pictur effect trustworthi given depart entiti evalu grade polic depart base variou metric propos index,AskSocialScience
think pretti self explanatori cent think natur resourc belong anybodi live countri decid extract natur resourc irrespons affect peopl area countri usual case privat compani hold natur resourc peopl profit privat sector look short term gain maxim profit usual mean loophol regul care local peopl environ current environment crisi especi s appar corpor want loosen grip stanc make money world nation natur resourc argument econom econom,AskSocialScience
crosspost askpsycholog layman day ago read wonder articl oliv burkeman suggest psychoanalyt therapi posit address issu root caus mental suffer cbt 1 possibl incorrect impress freud s theori larg consid pseudosci therapi base qualifi evid base treatment extent true 2 psychoanalysi better posit treat root caus mental ill cbt misread cbt embodi specif view pain emot primarili elimin fail toler condit depress bit cancer tumour sure figur came s far import rid cbt doesn t exactli claim happi easi impli s rel simpl distress caus irrat belief s power seiz hold belief chang psychoanalyst contend thing complic thing psycholog pain need elimin understood perspect depress tumour stab pain abdomen s tell need respons gp pump painkil send home happi thing achiev murkier matter t realli mind power motiv thing life len earliest relationship usual t realis want contradictori thing chang slow hard consciou mind tini iceberg tip dark ocean unconsci t truli explor ocean mean cbt s simpl standardis scienc test step 3 accur say cbt mental ill depress symptom irrat think tradit psychoanalyst practis newer psychodynam techniqu larg deriv tradit psychoanalysi happen therapi seemingli irrat symptom endless repetit self defeat pattern love work reveal somewhat ration respons sens context patient s earliest experi parent abandon year ago s strang live constant dread spous act screw marriag result cbt flip head emot appear ration feel depress catastroph life stand expos result irrat think sure lost job doesn t follow aw forev 4 consid piec written 2016 understand psychoanalysi chang effect psychoanalyt therapi relev today,AskSocialScience
post forgiv t realli work m sophomor colleg psych class realiz wasn t clinic aspect psycholog thought m research specif research anim compar human cognit develop e monki learn tool food compar human children learn fork similar thing m gener research human develop t career best fit anim psychologist closer development psychologist m sure recommend kind class help feel free suggest gener advic welcom d love knowledg field career fit research involv anim model human behavior,AskSocialScience
feel usa mandat mask wear result peopl wear mask variou type rebellion regardless assumpt right reason peopl buck situat,AskSocialScience
discrimin form racism away origin xenophob mindset help nomad tribe compet hurt wellb economi tribal patriot inevit human condit,AskSocialScience
thing gener taken public controversi thing proven wide believ social scientist,AskSocialScience
implic interact consumm chang time chang produc interact human social perpetr time sure mean massey write time time unaid bootstrap exist unless thing chang imman unfold unitari undifferenti ident mean,AskSocialScience
ancient time human tri explain origin mechan univers explan worship deiti mytholog involv deiti supernatur kind benevol malevol x200b elobor physic featur bodi anim ra falcon head anibu wing human bull mesopotamia abil shape represent osiri green skin hel half bodi dead old mytholog religion evolv religion includ exist today shift worship deiti nameless formless omnipot exactli specif represent certain trait feat jewish religion god specif consid sacr abramah religion christian islam simpli god god allah distinct previou deiti x200b did shift religion function occur reason shift religion evolv did deiti human support worship fear god elabor shape physic featur god nameless formless power histori evolut human societi explain chang,AskSocialScience
