clean_text,subreddit
thought half life element curium 248 rel long half life longer neptunium isotop trace element atom number 94 natur,askscience
number peopl life covid vaccin notic quit unwel day effect despit overal similar term age sex health statu peopl differ respons peopl experi effect vaccin,askscience
bismuth form consid stabl discov extrem long half life stabl isotop t absurdli long half live magnitut time age univers,askscience
new york time weekli tech columnist 2000 2013 m time emmi winner stori cb news sunday morn new york time bestsel author time ted speaker host 20 nova scienc special pb recent nova special mini element sequel 2012 documentari hunt element stapl scienc classroom worldwid new s hour episod worldwid quest key molecul chemic reaction make human civil includ concret fertil plastic rubber venom explos hot pepper written cowritten 120 book includ dozen miss manual tech creat 1999 book dummi line includ mac magic opera classic music novel middl schooler bestsel pogu s basic book tip shortcut tech money life guid iphon unlock mac unlock 620 page magnum opu prepar climat chang graduat summa cum laud yale 1985 distinct music spent 10 year conduct arrang broadway music new york won loeb award journal webbi award honorari doctor music live connecticut san francisco wife nicki blend brood spectacular children complet list column video sign email visit twitter m pogu web m davidpogu welcom civil email exchang david pogueman cours ll et 16 ut usernam m david pogu tech scienc writer host nova pb new element,askscience
crustacean lava snail anim live heat vent near ocean m curiou organ live closer extrem heat weaker immun,askscience
earth rotat sun sun rotat center milki galaxi center milki galaxi giant black hole serv acceler forc solar feel human earth black hole die happen center milki galaxi ceas exist,askscience
aa aaa batteri remot electron devic typic place altern opposit direct isn t standard face nippl case appl magic mous,askscience
saw product egyptian blue start wonder fecl3 isn t reaction reaction caco3 cuo 4sio2 cacu si4o10 co2 lead tri search answer onlin haven t abl answer fecl3 product egyptian blue prussian blue,askscience
rememb articl scientist covid 19 sewag sampl taken pandem true realli signific read studi subsequ discredit mean accord articl week french scientist test sampl pneumonia patient hospit got posit match earli decemb 27 2019 italian scientist covid sampl sewag far dec 18 2019 milan turin accord abstract medrxiv medrxiv abstract brazillian research report detect covid sewag sampl santa catalina florianopoli earli novemb 2019 accord reuter articl scientist univers barcelona test old sewag sampl got match covid 19 earli march 2019 date far pre date viru identifi countri pre date discoveri viru china result turn theori covid 19 spread head research clarifi possibl identifi issu caus studi fals posit predat pandem edit thought provok comment thank s respons late spring 2020 research world trace covid sampl thing sewag taken outbreak studi follow,askscience
dumb planet affect sun s graviti orbit mean slowli sun graviti pull object closer,askscience
genuin thought s mind figur right place ask anti global warm thing feel vibe ask technolog advanc 20 150 year household applianc automobil gener ton wast heat counteract search heat dissip tool radiat heat pump transfer wast heat case applianc requir heat output wast earth method radiat heat away c02 issu atmospher wonder natur t counterbal thing natur process anymor possibl scale big popul sheer applianc product modern era activ globe possibl factor concern global warm bogu afterthought modern infrastructur heat dissip concern global warm,askscience
theoret went fast start notic record effect approach speed light went did couldn t figur speed light rel wonder t speed light probabl wouldn t rel star center galaxi rel imposs speed light couldn t figur stop univers,askscience
space agenc nasa research grow crop moon usual say hydropon similar ideal grow crop consum lunar colonist far awar method applic crop shallow root got wonder possibl grow root crop e g potato carrot similar thing lunar regolith growth medium colonist abl set area adequ extern need plant optim light carbon dioxid concentr room grow possibl plant properli grow condit root lunar regolith possibl crop safe human consumpt issu regard radiat jagged regolith make crop unsaf consumpt feasibl convert regolith crop grown healthi safe human consumpt possibl cultiv crop lunar regolith,askscience
lot articl state fact water contain lot dissolv substanc t exact percentag percent tap water bottl water actual h2o,askscience
watersh grow size downstream river caus watersh growth connect posit river,askscience
cosmic microwav background redshift current frequenc format mean photon visibl nake eye wavelength pass short wavelength visibl light microwav wavelength,askscience
awar accident discoveri effect treat diseas couriou drive scientist think patient xxx diseas yyy molecul cure drug medicin invent,askscience
imag distanc mountain focal length infin 135mm make sens camera focal length say 18 135mm focal length technic extend infin,askscience
planet satellit solar ga giant real atmospher unlik night sky want confirm planet best moonlight,askscience
spread nois t hear turn heat happen nois energi longer hear nois,askscience
biolog mosquito bug bite actual caus bump form happen beneath skin,askscience
current studi second year univers midterm plant biolog intro cours topic short section lectur vasculatur xylem unclear exactli tracheid structur function inform help thank differ xylem vessel tracheid plant,askscience
quit simpl couldn t answer quick bit googl pour glass coke straight bottl fridg yesterday soon finish pour defin line bubbl quarter glass bubbl drink start struck odd glass water s photo minut line bubbl isn t quit clear idea thank caus clearli defin line bubbl glass coke,askscience
donat plasma treat ill covid 19 patient today said antibodi count level measur 108 s lot measur 120 said oh cool didn t ask info reason mean measur max 120 measur stand measur antibodi,askscience
kept s brain jar fed oxygen blood brain stay aliv indefinit eventu fail bodi s organ brain deterior organ peopl die old age,askscience
video plate tecton seen iberia franc itali eastern balkan suddenli appear 600 ma collid west africa sahara closur pharusian ocean did appear accret form land accret fulli form point did south western europ form,askscience
learn diesel electr locomot work lead wonder t similar princip larger commerci automobil surfac look especi effect modern locomot main altern produc ac power convert dc reconfigur 3 phase ac power individu motor drive wheel say tractor trailer diesel engin power larg altern drove individu ac motor wheel low end torqu standard transmiss abl cruis speed lot easili fuel effici diesel locomot astronom compar automobil case scale make differ engin machineri associ product cost make complet unafford diesel electr automobil feasibl t,askscience
capabl analyz water miner content,askscience
sorri covid vaccin haven t seen mechan vaccin explain assum shot basic bunch massiv replic strand coronaviru spike mrna mechan immun occur assum rna creat respons abl cdna thank mrna vaccin actual translat protein insid human cell rna sequenc detect foreign,askscience
say tin m curiou actual happen s free truth s friend waterhol scene thing lion king jungl book,askscience
m dr bechara choucair m nation vaccin coordin covid 19 respons team focus coordin time safe equit deliveri covid 19 vaccin u s popul close partnership relev feder depart agenc state local author lead effort administ 100 million vaccin 100 day svp chief health offic kaiser permanent commission chicago depart public health m carol johnson m nation test coordin covid 19 respons team previous serv commission new jersey depart human servic manag state s largest agenc includ medicaid child care food assist age servic mental health substanc disord treatment year serv obama white hous senior health polici advisor member domest polici council health team work afford care act implement issu public health challeng ebola zika work capitol hill member key health committe senat financ hous mean senat age u s depart health human servic health resourc servic administr allianc commun health plan pew charit trust american heart associ m tim man m nation suppli chain coordin covid 19 respons team m emerg manag disast emerg respons past 25 year work local state level serv fema year deputi administr firefight emt hand import equip suppli need need line crisi right work team govern depart defens depart health human servic ensur countri suppli need futur join 5 pm et 22 ut aua usernam proof twitter verifi updat thank realli good time hope answer help ll soon bechara carol tim bechara choucair carol johnson tim man vaccin test suppli coordin white hous covid 19 respons team aua,askscience
brogli came idea λ h p thing t mind differ regular formula λ v f obvious formula differ relat momentum wavelength ball ask measur wavelength behav wave particl result tri solv photon measur wavelength got 2 total differ answer tri measur wavelength ball h small 2 total differ answer formula differ brogli s wavelength oppos regular formula,askscience
determin determin rate constant reaction concentr constant temperatur chang concentr reactant chang temperatur chang rate reaction increas mean rate constant equal rate reaction temperatur affect rate constant concentr reactant m assum order reactant zero overal order reaction zero correct determin rate constant k reaction concentr constant temperatur chang rate law,askscience
current cold stretch roughli 0 f swing littl day littl night day sun hit ice crystal window melt round water droplet s cold evapor night refreez sort star pattern chang shape freez freez droplet think assum start freez outer surfac water cours expand freez m tempt think glass slightli warm droplet s close hous phenomenon happen screen case expos cold air tag physic suspect materi scientist help pattern remind dendrit crystal seen addit manufactur paper droplet spread star pattern freez,askscience
eleventh grade introduc concept quantum number sound stupid t fulli understand quantum number new fact right spin quantum number calcul spin electron electron spin clockwis given certain posit valu spin anticlockwis given neg valu look electron spin clockwis opposit rotat anticlockwis neg valu posit valu electron posit neg spin,askscience
soap sink surfac tension water gone theoret bodi water size ocean sure couldn t break entir surfac tension ocean far broken surfac tension reach reform hole middl assum turbul water actual ocean huge bodi water far bodi water soap break surfac tension s happen surfac tension reform,askscience
titl wonder flu pandem start mutat exist flu s introduc outsid speci human amen host flu epidem start patient 0 mechan,askscience
obvious actual land north pole ice look big slab ice flatten storm ice version regular geolog featur mountain cliff melt ice carv thing cave valley frozen ocean floor substanti effect float kind equival tecton activ larg sheet ice geolog ice olog structur north pole look,askscience
understand electr current flow electron conductor compar water flow pipe water rapidli shut caus water hammer similar happen electr current rapidli stop electr current similar water hammer,askscience
possibl tender meat enzym understand collagen make meat tough enzym break degre peopl pinappl tender meat possibl tender meat enzym collagenas,askscience
phospholipid chemic bond cytoskeleton hold membran chemistri flair assum s chemic forc hold phospholipid plasma membran cell idea caus phospholipid make plasma membran bond,askscience
polar ice cap sit ocean displac water ice dens water ice cap melt ocean level drop,askscience
father die 4 year ago toxicologist couldn t figur high level potassium bodi wonder link acut hemopericardium high level potassium deceas person,askscience
understand wind deflect slightli blade feel wind column straight blade affect energi output insight appreci curiou realli long time thank multipl wind turbin point direct air hit perfectli success turbin produc energi previou,askscience
saw hawk radiat s effect black hole scenario black hole decreas mass spontan format pair particl particl mass neg mass usual particl annihil shortli format event occur near event horizon black hole possibl particl mass escap observ radiat neg mass anti mass particl fall black hole decrement black hole s mass event event horizon said actual occur timelin outsid observ activ place observ black hole lose mass mechan place event horizon m misunderstand action actual place outsid black hole mass assum smear cusp event horizon matter captur black hole s format case true black hole s mass actual resid sort sphere outsid event horizon doesn t sound correct assum hawk radiat effect place singular s mass insid black hole fundament misunderstand black hole lose mass,askscience
basic titl instanc supernova betelgeus million year abl happen watch happen s nebula form sort timescal happen long supernova end nebula fulli form m unsur timescal end star life happen tell epic thank timescal nebula format,askscience
assum possibl say flu heard polio vaccin commonli administ sugar cube parent gener special polio allow vaccin taken oral instead inject,askscience
read articl articl today energi storag dens liquid instead water fluid case s 2 5x dens water suppos benefit facil smaller high look heavi liquid surpris didn t realli 3x densiti water wiki list appreci satur point s reach water surpris liquid achiev q s s stop readili avail heavi liquid 4 5 6 x dens water difficult make dens liquid,askscience
evid music influenc bird pattern mimic music surround area rememb read articl year ago bird differ area pattern influenc music surround exampl bird live urban set follow resembl sort hip hop beat rememb actual articl websit main reason ask human influenc bird whistl music,askscience
oxford vaccin affect sa variant pfizer vaccin,askscience
read articl scientif american tri explain rare phenomenon vortex ring appear plane contrail crow instabl caus vortic develop symmetr sinusoid oscil eventu merg form vortex ring jet instabl trigger turbul surround air local variat air temperatur densiti result stratif atmospher skim wikipedia articl vortic crow instabl stub gather ring vortic form fast fluid meet resist slower friction interfac creat vortex understand symmetr sinusoid oscil format vortex ring turbul requir doesn t ring contrail plane contrail creat smoke ring,askscience
gravit wave detect intuit compar gravit sens electromagnet wave photon gravit wave larg graviton unabl detect singl quanta fundament differ differ gravit wave hypothet graviton,askscience
abl prevent mild prerequisit prevent possibl vaccin x efficaci prevent ill x efficaci prevent mild ill,askscience
look globe huge structur look remnant ancient water ice eros illus rock format clear exampl 700km 500km fan straddl chad libya border mauritania look flow west atlant larg parenthesi shape cover saudi arabia structur huge saharan featur caus eros,askscience
rotor motor stuck reason mayb demand ask motor burn fail shortli read motor essenti turn transform secondari coil short circuit caus heat build true somebodi explain better thank induct motor burn rotor jam stuck,askscience
look wikipedia s number extint breed european contact north american neck wood kind curiou s inform avail exist dog popul inuit sled dog carolina dog pre columbian domest dog lineag left america addit dog landrac format current nativ american reserv,askscience
basic titl pressur need low fluoresc tube cathod tube,askscience
movi tv grievous sick injur treatment live die live die better want hard actual possibl,askscience
learn earth histori old aspen grove,askscience
son ask notic nest thermostat heat mode ga heat say eta 15 minut 1 degre summer say eta 2 hour 1 degre easier heat space cool heater vs air condition heater effici,askscience
understand gass liquid gass inher compress 2 cubic feet air stuff 1 cubic foot volum liquid gather taught compress compress time navi fireman loop ran design pressur didn t discharg 1 cubic foot volum hous 1 cubic foot water water exert forc hous make sens tri elabor doesn t psi measur liquid form fluid,askscience
wonder liquid oxygen occur natur planet asteroid metal miner float space occur possibl thing updat thank great comment didn t expect peopl answer commun awesom liquid oxygen occur natur,askscience
aiui s issu immun begin recogn vector adenoviru case foreign repeat dosag lead pronounc immun respons pronounc effect second shot m wonder pictur look peopl need 3rd 4th shot tweak adenoviru vaccin say 6 month previou exposur adenoviru viru base covid vaccin oxford astrazeneca vaccin result higher effect lower immunogen event administr vaccin updat account variant concern,askscience
blue 70 degre red 80 degre s red 70 degre blue 80 degre edit color thermochrom ink variou differ temperatur chang set extrem temperatur,askscience
moderna indic potenti make time dose exist manufactur footprint need lower dose common vaccin booster shot need smaller dose come refer moderna comment came articl moderna indic s booster shot develop work lower dosag exist vaccin allow manufactur far greater number dose,askscience
brain rhythm music control abil track longer durat,askscience
dutch scientist busi techniqu determin age fingerprint quantum dot tri contact t help s run project hope tell short understand want connect qd certain substanc left fingerprint ll glow glow differ problem techniqu fingerprint leav differ substanc depend surfac person pressur weather wouldn t mean person left fingerprint moment set pressur donor make oil gener touch lightli person recent true fingerprint substanc degrad chang construct molecul subject shine light qd help forens scientist determin age fingerprint,askscience
went rabbit hole studi spacesuit age didn t actual function mean check obviou faq pretti titl insert person vacuum chamber start suck air oxygen suppli obviu obviou layer need said person surviv end temperatur chang vacuum said person human blowfish isn t liter hope basic need bulki suit float perform repair iss x200b ps ye heavili inspir recent live appareantli perform repair station thank pressur insid spacesuit suit need human surviv vacuum chamber surfac level earth,askscience
s wide report sar cov 2 zoonot origin cross bat viru zoonot jump anim human extens viru zoonot start sole human bit odd given sheer magnitud variou speci earth wouldn t essenti virus start zoonot natur actual novel virus genesi sole 100 human think pretti human virus today initi zoonot natur s time adapt infect human time evolv longer abl activ infect anim aren t essenti novel virus zoonot origin,askscience
speed increas diverg nozzl air flow superson,askscience
possibl corona viru dose vaccin,askscience
think worst case scenario time creat new vaccin coronaviru mutat number possibl mutat affect vaccin respons limit coronaviru mutat evad vaccin south african mutat updat vaccin protect new variant viru run new mutat tri,askscience
sun planet mercuri known atmospher alongsid saturn s moon titan haven t heard satellit triton galilean moon atmospher size determin celesti bodi atmospher,askscience
somth realli small subatom scale say bacteria orbit somth big bowl ball 10 meter diamet steel ball bacteria orbit bowl ball,askscience
influenza mutat immun recogn gain entri cell differ influenza antigen bind receptor influenza antigen maintain abil bind human cell receptor constantli mutat,askscience
vaccin propylen glycol vaccin pfizer moderna deriv propylen glycol veget sourc petroleum natur ga edit ad natur ga propylen glycol covid vaccin deriv,askscience
percept conscious continu process awar time awar discret separ chunk tri googl academ research subject realli bunch repost singl opinion piec michael herzog contradictori paper isn t clear answer gener consensu wide held view research look s littl evid discret percept solv appar problem continu percept paper argu aren t problem continu think gener consensu matter moment conscious perceptu experi contin discret,askscience
level differ band aid duct tape metric adhes strength,askscience
watch count covid 19 vaccin cdc web site s gener s good differ graph daili count cumul daili chang t understand differ daili count daili chang think chang number cumul shot daili chang number shot given daili count graph significantli differ right reconcil cdc vaccin daili count differ daili chang,askscience
asteroid kill dinosaur believ hit earth rel shallow water gulf mexico asteroid instead land say mariana trench pacif ocean impact devast earth s climat,askscience
thought chlorid s concentr gradient cell larger concentr chlorid outsid cell compar insid cftr allow passiv diffus chlorid cell chlorid flow passiv cell cftr cystic fibrosi conduct regul protein allow passiv diffus chlorid cell,askscience
substanc toxic poison,askscience
heard signific human weight wast gut bacteria especi babi steril time breast fed babi differ bacteria formula fed babi babi acquir gut bacteria,askscience
edit im talk covid 19 peopl 16 abl vaccin,askscience
non human primat dead mourn bodi,askscience
gener produc electr coil rotat 100degre chang direct did exampl children swing set abl produc electr gener point rotat thank gener produc electr doesn t make rotat,askscience
quit self explanatori atom electroneg hydrogen boron size shield effect inner shell electron charg densiti answer greatli appreci thank hydrogen bond possibl hydrogen,askscience
patholog determin vegan,askscience
viru contain rna dna enzym replic insid host ensur content insid newli assembl viru particl,askscience
titl pretti say covid 19 particularli infecti differ penetr cell ace 2 receptor seen articl publish far 2002 coronavirus ace2 virus attach cell mump streptococcu rsv thank sar cov 2 ace 2 receptor access viru ace 2,askscience
product ga constant temperatur rt kinet thermodynam calcul,askscience
1 mrna vaccin provid protect base sar cov 2 variant infect spike protein right 2 lipid base pfizer moderna vaccin appear effect sar cov 2 adenoviru vaccin j j covid vaccin effect differ covid variant variant differ effect,askscience
exampl cancer surviv death host organ aliv today mayb fossil record theoret possibl cancer cell origin eukaryot bodi live abl sourc food host die mayb possibl evolv,askscience
human replenish plasma faster red blood cell,askscience
did googl couldn t point children tend milder case adult catch frequent gener children suscept covid 19,askscience
incid impact long term damag covid children,askscience
m read book oxygen advantag talk nose vs mouth breath notic walk mouth fog moistur air come cold morn breath nose vs mouth read book doesn t explain factor exhal mouth breath complet ineffect retain moistur verifi gentli breath mouth glass check moistur left thing exhal nose moistur left glass follow nasal exhal far moistur left exhal mouth loss fluid contribut moder dehydr result dryness lip mouth throat retain moistur nasal breath vs mouth breath tia lose moistur bodi mouth breath vs nasal breath,askscience
covid stat easier understand region promot test symptom 50 year test influenza sick suspect flu stay home haven t told friend famili doctor thought let test peopl aren t routin bring test number legitim come statist flu infect come,askscience
sorri miss uk base time zone issu hope comment heard quot 95 e g pfizer 70 effect oxford vaccin look underli studi output process make number complet incompar exampl pfizer test confirm pcr symptomat patient whilst oxford test uk cohort weekli regardless symptom result pick huge number asymptomat infect half uk infect seen studi includ calcul 70 figur sure mean compar basi pfizer efficaci lower compar edit number comment point fact base misunderstand think base uk studi report pool data articl oxford efficaci calcul appear look symptomat case actual compar realis thank comment quot lancet articl result section primari object evalu efficaci chadox1 ncov 19 vaccin naat confirm covid 19 primari outcom virolog confirm symptomat covid 19 defin naat posit swab combin qualifi symptom fever 37 8 c cough short breath anosmia ageusia vaccin efficaci covid vaccin abl directli compar,askscience
thought read covid vaccin come shot requir booster t booster shot help immun commit antibodi s longer term memori think s s happen singl dose shot time releas function singl shot supe begin singl shot act differ mechan bodi creat meaning longer antibodi compar appl orang vaccin requir second booster shot singl dose,askscience
newatla sound sceptic idea writer littl idea energi lost differ stage honour chemist weak point propos feel free skip lightli past pressur temperatur need make materi physic effici mgh2 h2o store energi releas hydrogen,askscience
case natur disast storm separ small group individu herd herd anim separ,askscience
hello recent read articl revers engin biontech pfizer vaccin articl link bnt162b2 mrna sequenc provid understand sequenc contain logic vaccin wonder sequenc inform given requir money machin base materi mix vaccin secret inform requir produc vaccin kept secret biontech pfizer biontech pfizer vaccin open sourc,askscience
read articl death shortli covid vaccin reassur death relat vaccin hasn t explan techniqu determin death relat vaccin provid public eas scientif data govern agenc death vaccin relat,askscience
live new york love break rock open fossil kind rock fossil,askscience
store qubit work quantum comput materi semi conductor,askscience
reinfect mutat measl viru despit massiv pressur measl mutat scientist worri likelihood sar cov 2 escap mutat pop viral infect measl lifetim mutat occur bypass immun respons sar cov 2 develop potenti immun escap mutat left right,askscience
