clean_text,subreddit
read entir post care format applic appropri post new panelist recruit previou panel inform group redditor profession scientist train panelist graduat level familiar declar field expertis answer relat area studi panelist s expertis summar color code flair membership panel come access panelist subreddit place panelist interact voic concern moder moder make announc panel s good place network peopl share elig join panel studi msc equival degre scienc abl commun knowledg field level access variou audienc instruct format panelist applic choos exactli gener field bar physic engin social scienc state specif field word phrase neuropatholog quantum chemistri succinctli particular area research word carbon nanotub dielectr properti myelin sheath degrad parkinson patient brief synopsi educ research scientist decad year ph d student provid link comment feel indic scholarship applic approv comment ideal comment clearli indic fluenci fundament disciplin expertis favor comment contain citat assess correct specif domain knowledg s exampl applic usernam gener field anthropolog specif field maritim archaeolog particular area research includ histor archaeolog archaeometri ship construct educ ma archaeolog research year comment 1 2 3 4 person identifi inform follow templat real life background check ask s best behavior moder task monitor panelist activ credenti check academ content post continu basi submit applic repli post panel scientist xxiv,askscience
tl dr week british scienc week answer scienc technolog affect life silli ask tri easi understand answer possibl provid sourc enabl research read goal simpli advanc s understand scienc engin technolog help peopl better inform issu affect famili info longer read cse regist chariti uk 1920 volunt group 250 member key strength divers interdisciplinari expertis member come varieti educ social econom background industri academia multitud age group repres group millenni silent gener oldest member 97 grow di inform global 20 year today s global interconnected huge benefici make inform easili access difficult determin truth trust independ chariti affili bias particular group broad knowledg answer hope point read goal simpli answer aren t abl advic thing sorri clear say experi base opinion team cse draw larg pool volunt answer peopl stand answer comment vic leverett obe 40 year engin experi previou director level posit europ s largest defenc engin compani honour queen obe servic engin defenc professor david humber 30 year experi research lectur senior univers manag specialis immuno biolog life scienc david whyte technologist charter engin 10 year research deploy experi 15 intern patent wide rang technolog ami knight scienc teacher artist experienc art scienc collabor organis soapbox scienc royal societi work featur tate modern s tate exchang anthoni mcquiggan 10 year engin experi 30 year serial entrepreneur built number success start sme technolog compani uk japan usa roger pittock 36 year experi electron softwar mechan electr process engin safeti avid support consum associ current serv council adam wood presid cse charter engin 12 year experi electron softwar engin work medic healthcar transport aerospac industri ask usernam group 250 engin scientist innov technologist digit expert design collect 45 phd professor 35 member repres nation scienc engin institut chariti aua,askscience
graviti electromagnet quit similar forc base mass charg respect object involv strong weak nuclear forc similar properti interact base graviti base mass electromagnet base charg analog properti weak strong nuclear forc,askscience
mrna pfizer moderna ad26 j j goal vaccin make spike protein lead antibodi t cell antibodi t cell creat type differ failur vaccin caus vaccin actual make antibodi t cell meant make differ aren t effect edit believ meant refer creation b cell instead creation t cell ll leav origin post explan help far thank antibodi t cell creat mrna ad26 vaccin differ,askscience
virus lead cancer later life interact happen virus similar coronaviru indic covid lead cancer incid line edit m ask data higher cancer rate peopl covid m ask viru similar structur function virus shown lead certain cancer significantli higher number hpv hepat c potenti covid 19 lead cancer line,askscience
look london weather report recent metoffic notic ye normal daylight hour increas sun rise 6 10am set 6 11pm thursday week day longer 12 hour 20th 21st 22nd march solstic edit discuss comment refin solstic 24 hour equinox thursday 18th march solstic day closest 12 hour length,askscience
virus diseas bodi rememb antibodi resist longer period time indefinit make covid differ bodi lose antibodi rel short period roughli 90 day iirc function viru mut natur function bodi vaccin allow bodi toler antibodi longer edit thank help respons t virus work inform antibodi lifespan immun creat miscommun media regard immun function quit eye open wish word titl better s plenti respons illumin error covid bodi retain antibodi short period time bodi essenti forget antibodi,askscience
peripheri innerv differ group nerv vagu nerv cranial nerv innerv closer did vagu nerv develop cranial nerv evolutionari explan evolutionari standpoint vagu nerv cranial nerv,askscience
did soviet space program american space program apollo guidanc comput,askscience
scientist creat viru stock blank viru modifi,askscience
circul alter medicin discontinu treatment caus rebound effect time dissip m curiou appli physic mechan method alter blood flow circulatori depend compress garment,askscience
basic understand mrna vaccin invok product protein covid 19 immun consid threat protein harmless consid threat lead form immun memori mechan simpl term differ viru viru consist reproduc select produc symptom spread tell understand incorrect mrna vaccin covid 19 function similarli rna base virus,askscience
happi pi day s march 14 3 14 mean s time celebr pi day grab slice celebratori pie post pi mathemat gener histori pi team panelist answer discuss intrigu pi expert answer pi enthral human pi end non repeat pi irrat number aren t base 10 irrat number repres real world relationship circumfer diamet read mathemat faq look specif piec pi search sequenc number 100 000 000 digit happi pi day cours happi birthday albert einstein pi day megathread 2021,askscience
m talk death vaccin complic allergi peopl fulli vaccin suffici dose wait time subsequ die covid 19 s gotta tini number realli 100 situat m normal pretti good pull random data m covid 19 death rate peopl fulli vaccin,askscience
region ga dust star format dynam chang faster galaxi right evolut observ nebula happen histori telescop exampl correl w scientif model fast nebula chang shape,askscience
t mean horribl sick common thing peopl deal day touch sniffl cold sore minor staph infect stye eyelid sort thing immun better abl respond s prime reduc capac respons s current busi current sick vaccin efficaci vaccin reduc,askscience
nuclear pasta electron merg proton dictat nuclear pasta s chemic properti explain simpl term astrophysicist,askscience
watch dr fauci talk stephen colbert earlier week said covid 19 unusu peopl symptom carrier transmit viru m guess larg test perform diseas influenza t work covid 19 transmiss asymptomat carrier s unusu,askscience
anim known produc structur keratin chitin,askscience
obvious planet orbit sun nearli perfect keplerian orbit m fine s bug orbit mechan 3 bodi instanc iss orbit earth nice round orbit center mass moon orbit earth barycent offset good 3000km obvious moon pull iss doesn t affect point orbit hand object orbit close binari orbit center mass opposit result cours extrem case rais extrem jupit offset solar s center come sun saturn orbit point orbit sun mar asteroid belt point space object best said orbit intuit tell equival mass govern shape speed orbit center mass bodi orbit sun inner planet object net chang outer object best think reconcil extrem case coher gauss law inuit correct instanc d mercuri orbit sun net influenc object apart perturb orbit venu acceler s mass mercuri ad sun word correct consid mercuri simpli perturb venu orbit sun increas effect mass posit sun mass differ depend close orbit venu complet wrong track sorri bit imprecis casual ponder haven t actual calcul point planet actual orbit,askscience
s realli realli far away feebl signal send interfer destroy meaning data reach earth voyag 2 send data earth,askscience
covid19 vaccin especi mrna ar highli 90 effect reduc blown case covid19 t protect 10 patient e g simpli peopl gener problem creat antibodi happen long term covid19 patient patient covid19 spite vaccin,askscience
read vaccin pretti complet prevent ill death true new nyc variant unknown soon estim vaccin protect ill death variant especi ny variant,askscience
liquid water ice sheet lake antarctica isn t freez point think supercool process contact ice t liquid water ice sheet,askscience
stop m misunderstand brain x200b hippocampu charg long term memori thing studi memor actual bigger want learn multipl work charact game throne hippocampu hold inform prefront cortex charg short term memori let s assum multipl work need answer 25 toothpick make iron throne replica 20 toothpick make second iron throne replica attach alongsid lego 20 toothpick iron throne 20 fourth toothpick need make 21 total iron throne sandwich row prefront cortex track figur tell 21 throne 25 toothpick s 25 toothpick plu 20 throne worth toothpick goe 20 time 20 time 20 400 s 400 25 s 425 toothpick s juggl live calcul say tell turn math formula figur toothpick need iron toothpick throne stuck brain abl translat logic good formula 25 20 1 number throne need math head doesn t mean logic write formula form brain handl translat mental math written math formula,askscience
dri air air condit increas transmiss rate covid 19,askscience
m honestli realli curiou natur good drawer better sport video game peopl sport video game requir good hand eye coordin good natur good artist share trait natur mean birth realli good draw thing hand littl effort better peopl age tri play sport video game mean preform better averag person similar iq fit natur good drawer better time sport video game averag person,askscience
realli sure flair guess psycholog say teach bird tool item teach bird offspr learn skill disappear gone possibl anim taught skill teach skill offspr,askscience
singl cell organ die old age,askscience
dinosaur fossil possibl absolut amaz realli cool look dino reason fossil die area conduc fossilis dinosaur genu possibl haven t discov probabl discov fossil possibl dinosaur speci genu discov discov,askscience
m wonder s studi point m specif dog open studi exampl train sit command treat posit reinforc e collar buzz constantli dog sit neg reinforc combin quadrant combin make learn effici oper learn effici simultan quadrant,askscience
feel open time t data understand mitig variant infect modern pfizer vaccin sens increas number peopl fulli vaccin assum protect data point probabl safe probabl problem data say protect effect mrna vaccin variant,askscience
say took blood drug test taken drug directli test metabol half life 24 hour blood test sent away lab final test 48 hour later concentr metabolit blood sampl decreas concentr metabolit decreas blood drug test,askscience
today got speed light specif calcul exactli did googl _c_ defin permitt _ε _ permeabl _μ0_ vacuum look number constant _c_ factor doesn t fact term defin partial _c_ mean tautolog defin _c_ term isn t defin speed light permitt permeabl tautolog,askscience
human pressur signific wound stop bleed anim kind anim address big bleed,askscience
did plant life surviv meteor impact wipe dinosaur 65 million year ago,askscience
b t lymphocyt constantli differ antibodi receptor,askscience
far understand estim age univers size observ univers rate univers expand long reach current size rate expans size observ univers mayb huge chunk outsid observ case age univers ps complet wrong understand thank advanc estim age univers,askscience
edit aw jeez mean gulf california yeah read wikipedia dri chang delta area river deposit bunch silt gulf chang affect gulf thank colorado river rare reach sea 1960 chang gulf mexico ecolog climat wise,askscience
snow suppos colorado wonder fast rain actual come upper limit fast precipit fall hypothet foot snow fall,askscience
covid 19 vaccin exhibit higher effici inject elderli compar younger gener,askscience
evolut speci start differenti determin new point process make modern exampl declar subset speci new excus flair incorrect point declar new speci exist,askscience
human cell chromosom nucleu depend specif function,askscience
cut arteri life threaten amput commonli practic,askscience
reason variou home blood test thing blood sugar std prick finger blood differ composit blood area versu arm leg throw test blood bodi finger prick test greatli effect specif sensit test reason home blood test blood finger,askscience
saw comment youtub talk refer fiction elv fantasi set claim true life longer speci s lifespan slower reproduc true long live speci tortois immort jellyfish slow reproduc speci s rate reproduct base lifespan,askscience
sparkl water heavier lighter non sparkl,askscience
hello bit troubl understand reason inhibitor understand make realli hard neuron creat action potenti block receptor postsynapt cell caus flow cl ion enter cell point point inhibitor place idk make sens tell need clear thank point inhibitor neurotransmitt,askscience
wonder stuff 3d print object anneal t exist chemic solut chemic solid higher temp liquid lower temp,askscience
abl feel notic andromeda galaxi collid,askscience
connect eat feel larg bodi research demonstr strong associ gut microbiom mental health microb associ neurolog disord rang degen diseas alzheim s parkinson s al dementia mental health disord depress anxieti preval today s societi t understand relationship establish maintain join today 2 pm et 19 ut discuss expert psychobiom organ american societi microbiolog asm ll discuss relationship microb host relationship impact behavior mood mental capac strengthen health microbiom ultim improv mental health today dr christi clutter ph d contribut writer american societi microbiolog dr sean gibbon ph d washington research foundat distinguish investig assist professor institut biolog dr jonathan lynch ph d postdoctor fellow hsiao lab ucla dr beatriz peñalv bernabé ph d assist professor depart bioengin univers illinoi chicago dr gregor reid ph d mba endow chair human microbiom probiot lawson health research institut link edit day thank work expert look connect gut microbiom mental health aua,askscience
search sourc sarscov2 make differ far treatment viru sourc import prevent pandem sourc sarscov2 covid 19 import,askscience
read lsd bind specif serotonin receptor serotonin caus effect aren t receptor thing synaps lsd drug brain,askscience
anim arctic circl day night rhythm polar night,askscience
hello curiou strong nuclear forc haven t weinberg s qft understand strong forc increas strength distanc color charg particl increas priori reason behavior phenomenolog flux tube explan introduc new symmetri similar behavior reason creat action inher behav reason lagrangian model observ thank cheer qcd lagrangian form observ analyt reason characterist,askscience
europ face case thrombolyt event happen shortli az jab 22 case 3 million observ scientist make statist anomali thrombosi happen higher frequenc regardless itali death current investig autopsi did confirm blood clot play role policeman soldier die cardiac arrest day vaccin didn t known pre exist condit vaccin did unknown condit obvious ask regard az vaccin specif death europ expect ill death happen short time suffici big popul autopsi prove link vaccin pre condit visibl diseas physician rule vaccin s role assumpt vaccin harm physician autopsi sign demonstr allerg reaction curiou autopsi exist explor caus death person unlik statist explor abnorm mortal subject autopsi reveal vaccin shot link suspect death,askscience
edit spell bozon titl boson weak forc weak w boson massiv extraordinarili short rang suddenli boson massiv abl expand reach weak forc littl energi bonu massiv particl short rang farther momentum right momentum work think scale thing boson expand rang weak forc decreas mass bozon,askscience
sit nice cup milk notic foami t understand chemic foam milk foam,askscience
tie fact littl fun tetrat x x x x form notic region infin number expon infin start search max x valu happen long stori short arriv y x 1 x function need maximum y valu lazi home x y valu simpli calcul tri number 20 step got 1 44466786 y 2 71815 x realli surpris home e mean infinitley tetrat valu x x x x maximum finit valu e x valu happen e 1 e f y x 1 x s maximum x e m year physic bachelor student handl higher level math s need answer e come x maximum y valu function f y x 1 x,askscience
stumbl rock uranium hike radioact rock everyday person concern accident touch,askscience
let s say case room temperatur beer outsid s 2 c leav doesn t place kind devic constantli swing cool faster liquid cool,askscience
docent museum favorit thing point tour set ichthyosaur fossil pictur dolphin skeleton converg evolut understand converg evolut phenotyp level realli thought s genet random mutat genet code possibl genotyp differ organ converg time realli underpin converg phenotyp level hear lot comparison genom speci share x x genet code banana chimpanze wonder s possibl converg genet level confus phylogenet analys make believ speci close relat truli possibl genotyp converg time phenotyp differ speci,askscience
graviti signific impact digest,askscience
isn t meant vaccin truther post genuin curios instanc hpv vaccin greatli increas bodi s abil fight viru hpv vaccin doesn t help t vaccin work teach bodi fend viru diseas infect viru diseas,askscience
earth s moon happen perfect size relat sun s size sky sure total partial solar eclips happen planet moon rare earth odd exoplanet moon perfect size creat solar eclips earth viewer sun s corona,askscience
exampl ocean crust goe continent crust mountain understood professor correctli tecton plate averag 100 200km depth t 100 200km high wall tecton plate submerg,askscience
titl state increas lift say ridgid airship origin helium portion ga remov ga possibl collaps explain stupid littl knowledg subject googl unhelp remov ga blimp ridgid airship caus lift,askscience
saw news veterinarian sar cov 2 vaccin avail primat similar human vaccin anim sar cov 2 strain differ human strain drug compani anim data phase 2 make anim vaccin differ veterinari human sar cov 2 vaccin,askscience
context honeybe rout confus understood asexu reproduct clone mean produc haploid offspr exact genet inform told work bee produc offspr asexu sexual queen bee produc haploid male asexu reproduct diploid femal sexual reproduct m littl confus diploid organ produc haploid genet ident sure won t genet ident lost half chromosom diploid organ asexu reproduc creat haploid offspr nonsens genet diploid organ asexu reproduc creat haploid offspr,askscience
currenlti studi gfp varient yfp understand mutat t203i produc face face pi stack interact aromat ring tyrosin chromophor residu 203 mutant tyrosin turn destabil effect chromophor turn red shift gfp yellow excit yfp look pi stack effect differ protein mneongreen mutat carri yfp caus t shape edg face interact residu chromophor caus destabil chromophor fact region chang interact wont repel eachoth face face interact attract pi stack affect fluoresc protein,askscience
read possibl cyp enzym possibl tri search didn t got answer tomatin convert tomatidin digest,askscience
ponder exot materi realli high speed sound understand object neutron star degener matter matter pack tightli possibl normal matter imagin mean speed sound rel high atom t travel far collid spread wave motion m wonder kind vibrat possibl given degener matter suppos tightli pack s actual space particl vibrat whack neutron star big cosmic hammer rock intern vibrat strike materi kind flow outsid join s materi collid speed sound neutron star degener matter concept appli,askscience
attempt ask let s hope mod merci clarifi mean frostbit m talk moder cold wind specul caus common cold cold temperatur caus contribut significantli bacteri viral inflamm research,askscience
come patient dementia rememb thing speak daughter brain memor thing brain dementia affect specif dementia patient rememb thing,askscience
m quit unlearn physic unlearn understand time 4th dimens read literatur state 4th dimens addit physic dimens faculti perceiv mean time dimens detect fulli perceiv fourth dimens differ entir m confus fourth dimens,askscience
edit apolog commun ask foolish potenti wast s time obvious moon tidal lock littl planet scienc wasn t sure rare common phenomenon suppos ll research come sub ask basic did help polit thank immens given lot m tri come set fantasi sci fi novel idea came possibl atmospher live condit planet bit googl peopl say topic read lot mix opinion guess insight great possibl planet tidal lock star face sun face dark,askscience
assum case come sort vector t thing happen longer vaccin infect fluke stop smallpox retransmit human time,askscience
place plane simul zero g experi fall space station constantli fall atmospher kinda affect earth s graviti differ zero g s felt space station zero g s space differ zero graviti space station zero graviti void space,askscience
apolog ask thread concret answer mayb didn t understand read mechan new adenovir vector vaccin az j j explan read simplist understand 1 modifi adenoviru enter cell 2 dna inject nucleu 3 mrna gener exit nucleu 4 cell start produc express spike protein 5 immun respons provok m wonder basic exactli happen cell viral dna degrad point dna cell s nucleu long step 3 execut vaccin administ muscl m guess s exactli muscl cell infect start express spike protein quick search lifetim muscl cell 10 15 year guess bonu cell express spike protein immun kill persist continu tri case doesn t great deal cell s suppos live long long dna viral vector vaccin remain host cell long cell execut instruct,askscience
watch documentari black hole apocalyps great mind blown tri comprehend super massiv black hole host janna levin fall black hole time slow crawl seen outsid observ neil degrass tyson chime say liter watch entir futur univers pass time slow matter approach black hole consum shouldn t traffic jam cosmic proport accret disc matter wait billion year pass fall black hole consum matter,askscience
far understand mrna goe ribosom output protein built base instruct mrna 1 ribosom molecular level read mrna make protein base understand correctli mrna singl strand dna ladder acgt sequenc 2 acgt base sequenc mrna chosen design mrna result ribosom creat expect protein ribosom read instruct mrna vaccin molecular level creat expect protein instruct design,askscience
look onlin lot thing gener liquid tend decreas viscos temperatur goe counterexampl thing think custard denatur protein caus thicken temperatur goe irrevers won t cool exampl liquid hot cool liquid viscou high temperatur low temperatur,askscience
light travel c vacuum affect graviti bend planet star light emit star travel rel slower ah speed away affect star s graviti light speed away sun graviti,askscience
mean coronaviru vaccin xx effect understand vaccin administ bodi produc antibodi vaccin 60 effect 98 effect mean administr vaccin 60 patient produc antibodi check antibodi test appropri time vaccin confirm person protect right percentag vaccin efficaci coronaviru vaccin effect rate mean,askscience
virus pass cell membran endocytosi protein interact antigen attach receptor envelop join membran order pass cell wall bacteriophag inject viru pass barrier cell wall gram posit cell membran gram neg pass barrier virus infect bacteria,askscience
cerebrum effect respir ask heard peopl suffoc result cerebr injuri especi cerebrum swell cerebrum effect respir,askscience
height smokestack determin,askscience
understand radio wave low energi photon modern camera sensor obvious design captur photon visibl light spectrum photon s photon right s stop make camera captur radio wave thing look wall possibl make radio base camera,askscience
lagrang point binari star posit,askscience
ask regard articl claim pfizer vaccin block 94 percent asymptomat infect explain arriv specif number thank edit typo titl meant asymptomat infect symptom extent vaccin block asymptomat symptom,askscience
pack arrang proton neutron atom nuclei word nuclei crystal structur,askscience
specif covid vaccin s gener tendenc board stronger immun respons vaccin pronounc effect translat better immun,askscience
heard reason strong forc unlik electromagnet despit massless carrier gluon strong forc carri charg mean gluon interact exactli happen gluon interact make strong forc differ electromagnet gluon carri charg influenc properti strong forc,askscience
recent read articl say better treat symptom efficaci treatment covid symptom near horizon bring mortal rate covid addit symptom better treat covid year ago u s faux lockdown began,askscience
imagin forc bar pull weight attach bar stay love hear explan equal pull bar expos forc pull compar hang,askscience
compar chart daili case israel countri especi usa canada chart look exact case decreas 43 fulli vaccin 55 dose aren t covid case decreas israel 55 popul vaccin dose compar countri,askscience
comput subtract ad s complement number output neg exampl 2 3 4 bit 0010 1101 1111 1111 convert 1 convert 15 differ ask comput perform 2 3 doesn t 1 15 1 comput number neg,askscience
good morn time post m curiou happen work project make fertilis plant wast crush compost biolog process m left dark brown black liquid doesnt look attract idea industri process chang colour solut make look attract thank alex improv colour liquid solut,askscience
