clean_text,subreddit
hello write kind request current student psycholog econom univers pari pantheon sorbonn conduct research societi everyday creativ order lead sustain life ask short questionnair 10 minut max order help research team respons anonym data gather research purpos questionnair advanc thank behalf research team creativ sustain,AskSocialScience
person social problem peopl deal,AskSocialScience
signific shift term time histor polit ideolog white ident group superior seek creat legal structur support belief akin state unequ racial outcom exist unclear defin term loos polit discuss white supremeci mean 2021 white supremaci mean 2021,AskSocialScience
islam whene somon kill execut steel cut hand muslim claim aplliyng rule decreas thz crime did previou time studi harsh punish reduc crime,AskSocialScience
seen homophob tran phobic peopl claim sex offend homosexu tran wonder studi actual truth portion sex offend lgbt,AskSocialScience
m cherri pick white male militari offic politician judg profess requir liter probabl weren t typo parent feel surnam u s civil war britannica featur jubal earli lafayett curri baker winfield scott pinckney benton stewart pinchback wade hampton leonida polk braxton bragg sterl price abner doubleday civil war wikipedia featur zabdiel boylston adam welti mccullogh suprem court justic includ bushrod washington levi woodburi salmon p chase melvil fuller howel edmund jackson mahlon pitney harlan stone did 18 19c educ caucasian american male weird,AskSocialScience
seen post talk men domin game industri post peopl actual said s 50 50 includ mobil game thought skew male d specif talk isn t femal pro gamer social issu biolog gate cultur simpl disinterest femal popul pro promot healthi environ foster femal pro gamer major leagu gamer men,AskSocialScience
learn toxic masculin recent understand societi encourag guy emot vulner girl instead guy receiv emot support signific divorc tend neg impact believ lack emot support lead guy hold misogynist belief commit rape act violenc believ boy school solut toxic masculin girl lead boy emot support evid feel m probabl stupid solut systemat tackl toxic masxulin boy school long term posit impact mental health guy,AskSocialScience
hello notion racial gender base bia justic polic bit difficulti data set outsid point relev studi studi sentenc bia base race gender canada europ,AskSocialScience
past literatur clear practic achiev middl class statu west educ high school degre today s societi longer win formula literatur scant regard recent read articl higher educ actual increas inequ extrem high cost educ absenc actual job requir higher educ educ lose import educ key middl class life,AskSocialScience
read recent wsj op ed pretti claim regard qualiti life dispar white black peopl list rememb goe follow black kid higher gpa high school white peer fallen longer ahead black white incom dispar widen black white colleg attend dispar widen articl evid substanti claim govern interf everyday life frame author professor shelbi steel black conserv firmli believ govern intervent prevent equal achiev m open new idea believ idea requir substanti particular piec absent said intens skeptic reason gap exist persist accur retel histor trend caus trend place edit happen wrong place post apolog certain qol gap widen black white peopl 1960 s,AskSocialScience
cognitiv constructiv new concept explor came piaget differ stage cognit learn vygotski learn social interact branch cognitiv constructiv x200b thank help cognitiv vs constructiv,AskSocialScience
m colleg grad tri understand trump s popular ideolog told tri understand postmodern conservat tri read coupl articl onlin head explain simpl thing sound oxymoron postmodern conservat,AskSocialScience
studi relationship polit polar popul size countri relationship relationship popul size polar conflict,AskSocialScience
men activ prayer religion men chose affili curiou religion belief head men lot agnost atheist men nowaday,AskSocialScience
hello m lawyer tri social scienc detest attorney research profession focu d start examin social underpin legal profess research countri specif given littl research home countri d theoret base order present research propos sociologist polit scientist anthropologist extens studi legal profess home countri begin far download essay roger cotterel legal sociolog d focu social background lawyer role state build suggest greatli appreci social research legal profess,AskSocialScience
s good book stat phd social scienc statist,AskSocialScience
research toxic masculin came accross make littl sens roughhous associ toxic masculin wrong realli benefit roughhous,AskSocialScience
feel hear watch news certain bia uneven view compar read sure write certain voic actual hear s inflect lead stronger bia m sure make sens let s say read articl ap reuter compar video s read articl view topic inform got articl viewer said video object read origin articl hope make sens m troubl thought word mayb record video research compar print news broadcast news,AskSocialScience
explain differ feel anxieti sort creat stress human stress strain biolog psycholog sort thing right anxieti vs stress,AskSocialScience
notic phenomenon europ america latin america east asia s capit cultur uniqu languag learn industri instead multipl industri person train person develop date industri type cultur exampl 1 market cultur 1 coach basic knowledg languag neighborhood lot peopl speak foreign languag 2 coach film talk foreign peopl unfamiliar peopl paid actor particip coach shock peopl script speech 3 coach upload video social media platform strong buzzword shock averag guy speak perfect x foreign languag 4 naiv peopl comment sign lesson buy digit cours 5 materi turn basic languag train beginn half peopl complain accept coach tell sign lesson buy cours 6 half complain write neg review coach say hater jealou success didn t work nativ audienc defend coach justifi action legal action 7 govern doesn t care doesn t involv transact exampl 2 1 languag coach promis learn french 30 day ll money 2 student sure ll tri academ say languag learn longer 3 languag coach t listen academ t talk new method devis 4 student sign lesson end subpar coach make intern teach lesson 5 student ask refund grant instead coach doesn t bother won t answer 6 student refund simultan minor doesn t shame friend famili fool believ coach eventu minor let write bad review 7 govern larg doesn t involv isn t prioriti regul industri 8 complain languag teacher accus fake capitalist societi bring market cultur cultur scam s lot industri unregul languag learn exampl,AskSocialScience
listen interview american comedian base japan said purpos comedi japan differ purpos comedi america japan purpos comedi escap everyday life america comedi focus social critic book talk aesthet sensibl especi differ countri cultur comedi exampl,AskSocialScience
typic religion s infanc egalitarian attract peopl walk life time religion grow accumul adher extern cultur develop s ident reinforc extern social hierarchi social histor wealthiest connect peopl religi connect christian islam particular religion s emphasi chariti wealthi social advanc individu group domin role societi high social capit abil financ poor lead role did religion play enhanc limit social inequ role did religion play enhanc limit social inequ,AskSocialScience
quick googl search t inform percentag unemploy regist republican democrat,AskSocialScience
book mention morn sick isol tribe tribe littl access western medicin food morn sick,AskSocialScience
genuin nation combat gener usag alcohol societi apart prohibit fail horribl exactli alcohol se drink small boost confid friend parti late notic horribl effect belittl alcohol consumpt human societi solut warn label bottl heavier tax stigmatis consumpt ad literatur forbid consumpt public space heavier educ school ban alcohol ad fight poverti unhappi fertil ground addict ban alcohol super market avail liquor store regul time look forward solut critic state answer effect combat human alcohol problem,AskSocialScience
effect game aid learn compar educ activ game stand improv studi educ game effect,AskSocialScience
age matriarchi end organ societi basi land properti power war end matriarchi,AskSocialScience
gender dysphoria children topic receiv lot attent recent thing wonder s diagnos friend said concern children instead confus stereotyp behavior signifi gender role appear kid think gender actual gender non conform factor address make diagnosi kid gender dysphoria diagnos,AskSocialScience
m watch netflix older peopl child star wonder sound young adult s differ 20 year old voic 70 year old voic thought time listen podcast m surpris hear 50 60 sound 20 year old vice versa older voic 60 90 sound differ younger 20 30 hear differ accent vernacular older peopl date phrase hear age s s voic,AskSocialScience
s post europ map state self report result women experienc violenc sexual physic intim partner comment t realli provid discuss countri result decid look sourc realli reach sort answer hope dichotomi fact danish women close zero percent toler violenc self report occur higher women live societi argu s justif beat femal partner ask survey weren t subject iirc anonym sure make easier true answer s posit correl preval gender base violenc european gender equal index score,AskSocialScience
involv factor long regard relev high divorc rate differ countri remain unexplain exampl peopl argu lower divorc rate itali poland ireland latinamerica caus faith catholic higher divorc rate czechia compar caus higher degre secular understand divorc rate itali lower spain addit compar differ orthodox countri divorc rate russia belaru ukrain higher bulgaria romania serbia georgia countri ussr undergon commun regard caus secular good materi compar analyz divorc rate differ countri especi european countri materi compar divorc rate differ countri analyz reason differ,AskSocialScience
definit factor cognis begin ostens root modern race conflict point furthermor understand latino academ consid race distinct colloqui immateri latin american gener consid black oppressor latin american coloni power domin major tran atlant slave trade,AskSocialScience
margin product labor theori true isn t true equip carpent produc saw accord theori saw cost lot actual obvious s suppli bring saw price margin product labor theori ignor suppli labor market margin product labor theori,AskSocialScience
m current write phase phd supervisor suddenli said discours analysi analysi point clear desir autoethnographi methodolog tri fit read doesn t s field purpos research briefli outlin research onlin autoethnographi involv spend signific time variou forum read post record field note aim write experi studi forum refer broader theori explain observ link observ broader cultur phenomenon m bit concern t realli discours analysi fit especi discours analysi supervisor mean foucauldian discours analysi work feel conflict methodolog autoethnographi thought realli help thank advanc autoethnographi discours analysi,AskSocialScience
russia develop countri orthodox church power domin life poverti rate high countri quit rural bbc did documentari marriag religion countri interview fairli typic russian man women treat upload titl littl insincer view famili life tell tradit patriarch straight lace countri peopl piou lifestyl old fashion idea famili life mean expect russia high fertil rate unlik nigeria pakistan russia low fertil rate 1 5 birth woman replac level far nigeria s 5 6 children woman doesn t russia high fertil rate,AskSocialScience
assum year colleg degre fairli long time chang person s perspect relat behavior attitud outcom 1 develop higher state civil 2 develop understand litter vandal theft disord harm good oper societi 3 develop prefer resolv heat disagr word violenc conserv opinion polic offer perspect civil order make urban life possibl civil art live citi innat learn throw sand kid stand line turn blast music apart car display affect publicli block sidewalk market aisl yell cellphon cram pizza maw street public transport litter monopol public space express behavior cut pedestrian crosswalk bother offend unnecessarili benefit colleg educ confer person asid broader understand world knowledg field translat career,AskSocialScience
muslim current peopl world violent reject fundament precept modern life muslim uniqu difficult success adapt modern,AskSocialScience
ask specif tech categori youtub gender demograph cross cultur studi compar cultur valuabl studi look gender demograph youtub categori,AskSocialScience
write commonli understood string arrang symbol ascrib mean human invent correspond sound concept record store inform durabl form time differ proto write fulli develop write defin,AskSocialScience
mistak die video affirm action make,AskSocialScience
nordic countri realli fond metal music misrepresent fact band capita world metal band,AskSocialScience
m look articl research deal scotu rule effect public opinion subject doesn t specif aca dream abl litteratur deal public opinion effect scotu look opposit thank advanc unit state suprem court influenc public opinion,AskSocialScience
read averag men thing women peopl biolog cultur studi attempt women s peopl thing biolog cultur,AskSocialScience
recent read paper paradox femal happi women experienc expans right incom 1980 happi decreas possibl reason declin revers trend paradox declin femal happi femal happi declin 1980 male happi increas,AskSocialScience
wonder point research effect exposur parent sexual express younger children adolesc think parent social media account combin person form sexual express activ twerk particip tik tok trend highlight sexual danc post pictur highlight accentu s bodi sexual manner activ presum visibl child presenc literatur sexual overt bring sexual partner home particip sex work children adolesc mean distnguish express care affect parent versu form sexual express direct peopl child onlin viewer non committ sexual partner curiou gener literatur examin effect children expos parent sexual natur gener hear accident parent sex toy condom hope ideal empir research theoret effect exposur parent sexual children,AskSocialScience
hello thank time read littl bit context friend talk histori class cover discrimin minor group includ asian black person asian american notic discrimin black classmat liter exampl discrimin happen peopl teacher t hear teacher pay attent sudden basic come discrimin differ minor group differ similar time progress era happen regard discrimin asian american gone away discrimin african american remain,AskSocialScience
best exampl guy notabl discrep norm expect peopl descript empir peopl actual smooth consumpt eat healthi norm vs disrupt discepr,AskSocialScience
sociopath ignor conscienc,AskSocialScience
particularli franc muslim deliber offend nativ french peopl believ discrimin lash conflict european muslim commun surround societi,AskSocialScience
m sure best place ask t data studi recent year decad school polici fight parti punish equal regardless start blame likewis bulli continu harass kid school littl kid snap hit bulli kid punish basic imposs kid defend reason punish bad wors offend studi rise phenomenon school shoot hypothesi bulli kid left legal option defend escap bulli invok nuclear option bring deadli weapon school relationship school shoot zero toler polici especi fight,AskSocialScience
feder reserv white american median household wealth 188 200 latino 36 100 african american 24 100 gap stark look incom gap disappear white american averag household incom 70 642 versu latino 51 450 african american 41 692 latino 20 household wealth white peopl earn 70 white peopl make racial gap household wealth wider racial gap household incom,AskSocialScience
guy rais texa m awar s subtli influenc indirectli clint eastwood movi peopl handl conflict rest world handl conflict northeast phrase happen planet read littl southern honor cultur altern peopl handl interperson conflict,AskSocialScience
attempt repres sampl peopl got cancel categor got cancel effect cancel ask hard form opinion cancel cultur unclear actual effect cancel cultur anecdot s easi spin narr cancel cultur result innoc peopl unjustli punish abus final shit research help clear closer truth research peopl cancel effect cancel differ group peopl,AskSocialScience
live south africa zombi apocalyps govern shut sale alcohol soon covid peak time reason provid south african unhealthi relationship alcohol overload public health alcohol relat injuri leav littl space peopl suffer covid argument evid m south african unhealthi relationship alcohol result old law s got independ england 30 30 south africa english coloni result rule alcohol sale time super constrict law radio tv frequenc industri england looong ago privileg travel asia thing appar south african buy alcohol 7eleven time day night peopl unhealthi relationship alcohol far didn t issu second argument puzzl corpor compani treat employe 1st hand experi corpor compani tend treat employe children e g creat team team come compet team hand treat won s hard explain work corpor probabl m talk respons away employe straight playground mode treat long come argument believ south african govern mayb unintent thing year year revis law treat south african children away respons degre limit access want caus restrict lift peopl crazi access alcohol bump hospit admiss caus confirm bia govern m 41 long rememb alcohol law strict covid nation emerg t buy alcohol bottl store 6 8pm depend money liquor store fork liquor licens weekend earlier liquor store close sunday liquor licens m sure bunch uk law place s tax peopl pay tax point need resolv forward adult children ground feedback welcom law creat unhealthi relationship alcohol,AskSocialScience
guess difficult quantifi regard qualiti data receiv peopl fear come drug wonder studi relationship happi satisfi job career drug thank lot relationship employ satisfact drug,AskSocialScience
hey guy m start podcast want deep dive psycholog mental health richard ramirez didn t netflix doc paint liter devil incarn didn t discuss mental health deep googl read court doc report haven t concret descript psycholog profil contrast report peopl say schizoid person disord peopl say didn t came descript diagnosi axi 1 rule bipolar l cocain depend polysub abus axi 2 did w sexual sadist religi foi aspd narcissist featur rule psychosi specifi axi 3 hep c intraven drug abus axi 4 famili discord addict social isol incarcer axi 5 33 m current undergrad minor psych fair dsm5 littl dsm4 5 axi did research think figur mean m confus realli educ psycholog love respons agre did diagnosi m heard say suffer did tldr m sick contrast report realli want precis possibl podcast episod need help clarifi richard ramirez s psycholog profil,AskSocialScience
wonder differ spencer s drukheim s function,AskSocialScience
extens read issu u s intern angl left claim problem systemat discrimin black usa muslim western europ roma gypsi eastern europ right claim commun exhibit problemat behaviour right exampl asian migrant success usa good evid argument major consensu sociologist issu model minor vs problem minor,AskSocialScience
somewhat charg m tri establish s quackeri valid claim larri elder figur welfar neg affect black livelihood,AskSocialScience
woc s common experi live experi racism prejudic exampl sure race overreact m curiou reaction individu minor group person face experi close relationship experi sound credibl fascin person lose acknowledg live experi happen t relat experi deepli root psycholog social caus caus domin group quick dismiss minor experi racism,AskSocialScience
provid perspect debat articl did reform increas absolut poverti did neg effect effect 1996 welfar reform,AskSocialScience
m capston project school radio station come theori goal rebrand station appeal new student want school theori help research commun capston project,AskSocialScience
m read correctli black asian crime near twice high black white crime black latino s best theori explain discrep regard 2018 bureau justic figur,AskSocialScience
proport men littl bit higher women men activ femal spous women wait choos men,AskSocialScience
assum sort group group dynam feel complic specif m talk retir athlet watch old team play tie ident self worth guilti feel s sens proud teammat coach person thank advanc want stab difficult watch peopl aren t t apart anymor,AskSocialScience
grow non white mainli hispan popul caus grow inequ big racial gap,AskSocialScience
mexican latin american think west speak romanc languag spanish portugues profess western religion cathol christian t fact great social econom inequ region larg popul mestizo non european influenc consid western think latin american consid west,AskSocialScience
m african american rememb attitud support black busi commun black busi directori black hire board creat black busi directori 6 year ago didn t idea black peopl busi black peopl help black commun got think race did race busi peopl race obvious happen homogen countri happen unit state studi prove disprov peopl busi peopl look improv commun heard black wall street work liter law prevent busi peopl necessarili work better peopl look,AskSocialScience
major overarch government interperson differ cultur harsh winter vs did differ cultur harsh cold winter vs cultur did,AskSocialScience
did social movement stuff ricardo federico lead igmo defector igmo support actual happen talk 11 55,AskSocialScience
disclaim obvious tri highlight think m smart wonder s sociolog psycholog research talk chang occur higher iq person think possibl capabl talk lower iq fundament differ autonom respons convers stimuli respons shallow mirror speaker t m accommod excess convers superflu elicit scintil thought clear convers def refer endur effect research peopl iq gap interact,AskSocialScience
wasn t aliv time music movi 60 70 weed drug absolut seen big deal odd peopl era oppos legal s graph studi anybodi older peopl 65 oppos marijuana legal averag grew hippi free love vietnam era,AskSocialScience
common tactic peopl stigmat verbal express certain opinion,AskSocialScience
youth countercultur hippi punk subcultur exist decad,AskSocialScience
m say broad gener s phenomenon seen want clarif think differ societi oper observ latin american societi peopl t read educ televis peopl read tend professor professor publish book professor read doesn t widespread practic young peopl publish novel book attent unit state s vast countri contin professor case similar mayb associ professor stick neck write book professor read publish polit book need substanti evid look ph d grad publish book special journal end ph d given huge countri young person publish polit book novel releg nich mayb ll fan nich unknown public larg seen polit class connect busi world oppos intellectu academ world t politician talk abstract theori tri appeal mass argentina heard franc similar cultur thing happen t think uniqu argentinian societi exampl m familiar 1 s larg number peopl read publish author berliac said decid publish book publish 2 t need ph d associ professor peopl listen say intellectu agustin lang undergradu student publish polit theori book peopl listen popular 3 public intellectu read say weight appear connect polit class intellectu class agustin lang said argentinian politician came told read book plan advoc idea think countri societi cultur public intellectu author widespread weight intellectu play differ role differ societi argentina franc,AskSocialScience
apolog super obviou american canadian t search lot quaker lot tradit pull uk liber lean suppos m look term old new world big cultur differ great lake region new england miss north america sorri s obviou m look text mid 1800 preoccup idea area north east ohio pei m sure m make cultur connect want idea includ liber idea educ emancip trancendent popular m sure leak new england help amaz includ text think read say vastli differ peopl live region mean scandinavia tie similar climat religi tendenc histori cultur differ term great lake canadian maritim new england,AskSocialScience
sure appropri place apolog m curiou differ cultur establish variou tradit idea break middl day obviou thing british tea spanish siesta italian riposo swedish fika m fascin type break tradit gener similar subtl differ central focu food tea coffe sleep rest m curiou non western cultur non industri cultur similar break time tradit exampl societi t revolv 8 5 workday structur variou asian cultur older tradit tea ceremoni hour alter shorten version emerg adapt modern schedul tradit common genesi histori point essenti m look inform break cultur gener honestli biggest difficulti inform tradit differ cultur search variou term english far academ sourc catalogu similar recommend studi greatli appreci break time tradit differ cultur,AskSocialScience
studi m refer say recent year partner woman divorc studi doesn t appli men studi true doesn t appli men wouldn t conclus come appli men women compar current partner previou partner satisfi appli men women tire sex lot partner wouldn t appli men studi say women promiscu divorc doesn t appli men s,AskSocialScience
relat upbring t t caus good hypothesi note sexist action sexist belief mean case think ok catcal grope stranger caus men sexist special catcal harass,AskSocialScience
exampl 1 huge evid black peopl imprison white peopl s racism justic x200b exampl 2 huge evid men imprison women s sexism justic x200b 1 fals equival fals 2 exampl correl outcom impli causat effect fals equival exampl correl impli causat,AskSocialScience
